<?xml version="1.0" encoding="UTF-8"?>
<messages xmlns="http://com.pwrd.war.message" xmlns:xsi="http://www.w3.org/2001/XMLSchema-instance"
	xsi:schemaLocation="http://com.pwrd.war.message message.xsd" module="secretShop">

	<message type="CG_SECRET_SHOP_LIST" comment="查询商品列表">
		<field type="Boolean" name="isNpc" comment="是否为npc商店"></field>
		<field type="String" name="id" comment="npc或者商店的id"></field>
		<field type="Boolean" name="isRefresh" comment="是否强制刷新"></field>
	</message>
	<message type="GC_SECRET_SHOP_LIST" comment="返回商品信息">
		<field type="Boolean" name="isNpc" comment="是否为npc商店"></field>
		<field type="String" name="id" comment="npc或者商店的id"></field>
		<field type="com.pwrd.war.common.model.secretShop.SecretShopInfo" 
			clientType="SecretShopInfoData" name="secretShopInfo" list="true" comment="神秘商店商品列表" macro="SecretShopInfo" ></field>
	</message>	
	
	<message type="CG_SECRET_SHOP_BUY" comment="购买物品">
		<field type="String" name="itemSn" comment="商品的sn"></field>
		<field type="Integer" name="number" comment="商品的数量"></field>
		<field type="Integer" name="position" comment="商品的位置"></field>
	</message>
	
	<message type="GC_SECRET_SHOP_BUY" comment="返回购买结果">
		<field type="Boolean" name="result" comment="购买结果"></field>
		<field type="String" name="content" comment="购买结果的内容"></field>
		<field type="String" name="itemSn" comment="更新为已购买的物品sn"></field>
		<field type="Integer" name="number" comment="剩余数量"></field>	
		<field type="Integer" name="position" comment="商品的位置"></field>
	</message>
	
	<message type="GC_SECRET_SHOP_TIME_REMAIN" comment="返回剩余时间">
		<field type="Long" name="time" comment="剩余时间"></field>
	</message>
	
	<message type="GC_SECRET_SHOP_BUY_INFO" comment="用户购买信息">
		<field type="com.pwrd.war.common.model.secretShop.SecretShopBuyInfo" 
			clientType="SecretShopBuyInfoData" name="secretShopBuyInfo" list="true" comment="用户购买信息列表" macro="SecretShopBuyInfo" ></field>
	</message>
	
	<message type="CG_SECRET_SHOP_PRECIOUS_INFO" comment="神秘商店珍贵物品">
	</message>
	<message type="GC_SECRET_SHOP_PRECIOUS_INFO" comment="神秘商店珍贵物品">
		<field type="com.pwrd.war.common.model.secretShop.SecretShopPreciousInfo" 
			clientType="SecretShopPreciousInfoData" name="secretShopPreciousInfo" list="true" comment="神秘商店珍贵物品" macro="SecretShopPreciousInfo" ></field>
	</message>
</messages>